"k","subject.parasitological_analysis","subject.anlise_parasitolgica","subject.qualidade_microbiolgica","subject.doajbiology","subject.hortalias_minimamente_processadas","subject.doajbiology_and_life_sciences","subject.doajmicrobiology","subject.microbiologic_quality","subject.minimally_processed_vegetables","subject.science","subject.microbiology","coauthor.frizzo_verdin","coauthor.pereira","coauthor.schatkoski","coauthor.rott","coauthor.pavan_da_silva","subject.pseudomonas_aeruginosa","subject.resistncia_bacteriana","subject.guas_superficiais","subject.hospital_sewage","subject.medicine_general","subject.esgoto_hospitalar","subject.surface_water","subject.doajmedicine_general","subject.medicine","subject.doajhealth_sciences","subject.bacterial_resistance","subject.efluente_hospitalar","subject.metalolactamases","subject.metallolactamases","subject.p_aeruginosa","subject.doajlife_sciences","subject.biotechnology","subject.biopreservative","subject.antimicrobial_activity","subject.enterocins","subject.technology","subject.enterococcus_mundtii","subject.doajbiotechnology","subject.chemical_technology","subject.metallolactamase","subject.nonfermenting_bacteria","subject.gramnegative_bacilli","subject.nofermentadores","subject.metalolactamase","subject.bacilos_gramnegativos","subject.metalo_lactamases","subject.multirresistncia","subject.metallo_lactamases","subject.multiresistance","subject.carbapenemases","subject.wheat","subject.animal_culture","subject.doajagriculture_and_food_sciences","subject.doajanimal_sciences","subject.probiotic","subject.trigo","subject.enzimas","subject.agriculture","subject.probitico","subject.enzymes","subject.gas_chromatography","subject.solvents_separate","subject.fatty_acid_fa","subject.agriculture_general","subject.extract_lipids","subject.doajagriculture_general","subject.conjugated_linoleic","subject.keywordkeywordfatty_acid_methyl_esters_fame","subject.transesterification_of_triacylglycerols","subject.reagents_commonly","id","name","title"
gcoro,1,1,1,1,1,1,1,1,1,1,1,1,1,1,1,1,0,0,0,0,0,0,0,0,0,0,0,0,0,0,0,0,0,0,0,0,0,0,0,0,0,0,0,0,0,0,0,0,0,0,0,0,0,0,0,0,0,0,0,0,0,0,0,0,0,0,0,0,0,0,0,"30|doajarticles::77413e97794e1e0c4f97ed29332e2d36","Gertrudes Corção","Microbiological quality of minimally processed vegetables sold in Porto Alegre Brazil Qualidade microbiológica de hortaliças minimamente processadas comercializadas em Porto Alegre Brasil"
gcoro,0,0,0,0,0,0,0,0,0,0,0,0,0,0,0,0,1,1,1,1,1,1,1,1,1,1,1,0,0,0,0,0,0,0,0,0,0,0,0,0,0,0,0,0,0,0,0,0,0,0,0,0,0,0,0,0,0,0,0,0,0,0,0,0,0,0,0,0,0,0,0,"30|doajarticles::8ed86142d39f3e1f9a014670de4f1986","Gertrudes Corção","Pseudomonas aeruginosa: disseminação de resistência antimicrobiana em efluente hospitalar e água superficial Pseudomonas aeruginosa: spread of antimicrobial resistance in hospital effluent and surface water"
gcoro,0,0,0,1,0,1,1,0,0,1,1,0,0,0,0,0,0,1,0,1,0,0,0,0,0,0,1,1,1,1,1,0,0,0,0,0,0,0,0,0,0,0,0,0,0,0,0,0,0,0,0,0,0,0,0,0,0,0,0,0,0,0,0,0,0,0,0,0,0,0,0,"30|doajarticles::d03449aff60a2c871e7aace5dab5a25d","Gertrudes Corção","Spread of Metallo-&#946;-lactamases: screening reveals the presence of a BLA SPM-1 gene in hospital sewage in southern Brazil Disseminação de Metalo-&#946;-Lactamases: triagem revela a presença do gene BLA SPM-1 em efluente hospitalar no Sul do Brasil"
gcoro,0,0,0,0,0,1,0,0,0,0,0,0,0,0,0,0,0,0,0,0,0,0,0,0,0,0,0,0,0,0,0,1,1,1,1,1,1,1,1,1,0,0,0,0,0,0,0,0,0,0,0,0,0,0,0,0,0,0,0,0,0,0,0,0,0,0,0,0,0,0,0,"30|doajarticles::202f3659b346573029cb81363eead20b","Gertrudes Corção","Characterization of enterocins produced by Enterococcus mundtii isolated from humans feces"
gcoro,0,0,0,0,0,0,0,0,0,0,0,0,0,0,0,0,0,0,0,0,1,0,0,1,1,1,0,0,0,0,0,0,0,0,0,0,0,0,0,0,1,1,1,1,1,1,0,0,0,0,0,0,0,0,0,0,0,0,0,0,0,0,0,0,0,0,0,0,0,0,0,"30|doajarticles::0d03dd907ddf74edb9acb38108579e49","Gertrudes Corção","Pesquisa de Acinetobacter sp e Pseudomonas aeruginosa produtores de metalo-&#946;-lactamase em hospital de emergência de Porto Alegre Estado do Rio Grande do Sul Brasil Investigation of metallo-&#946;-lactamase-producing Acinetobacter sp and Pseudomonas aeruginosa at an emergency hospital in Porto Alegre State of Rio Grande do Sul Brazil"
gcoro,0,0,0,0,0,0,0,0,0,0,0,0,0,0,0,0,1,0,0,0,1,0,0,1,1,1,0,0,0,0,0,0,0,0,0,0,0,0,0,0,0,0,0,0,0,0,1,1,1,1,1,0,0,0,0,0,0,0,0,0,0,0,0,0,0,0,0,0,0,0,0,"30|doajarticles::74c8969f84dcef6f9ed0bba88caec11b","Gertrudes Corção","Ocorrência de cepas de Pseudomonas aeruginosa multirresistentes produtoras de metalo-&#946;-lactamase blaSPM-1 em amostras clínicas Occurrence of multiresistant strains of Pseudomonas aeruginosa producing metallo-&#946;-lactamase blaSPM-1 in clinical samples"
gcoro,0,0,0,0,0,0,0,0,0,0,0,0,0,0,0,0,0,0,0,0,0,0,0,0,0,0,0,0,0,0,0,0,0,0,0,0,0,0,0,0,0,0,0,0,0,0,0,0,0,0,0,1,1,1,1,1,1,1,1,1,1,0,0,0,0,0,0,0,0,0,0,"30|doajarticles::f2dd2c947074e8b033e63227716d1251","Gertrudes Corção","Microbiota ileal de frangos de corte submetidos a diferentes dietas Ileal microbiota of broilers fed different diets"
gcoro,0,0,0,0,0,0,0,0,0,0,0,0,0,0,0,0,0,0,0,0,0,0,0,0,0,0,0,0,0,0,0,0,0,0,0,0,0,0,0,0,0,0,0,0,0,0,0,0,0,0,0,0,0,1,0,0,0,0,1,0,0,1,1,1,1,1,1,1,1,1,1,"30|doajarticles::74096baf7e09687ddeded95d9e067d97","Fabio Augusto Garcia Coro","IMPLICATIONS OF METHOD CHOSEN FOR ANALYSIS OF FATTY ACIDS IN MEAT: A REVIEW"